{
  "feature_id": "example-clean-template",
  "goal": "Validate that the clean template can carry a small feature slice from spec to verification.",
  "scope_in": [
    "feature brief",
    "placeholder asset planning",
    "verification planning"
  ],
  "scope_out": [
    "engine-specific implementation",
    "production art"
  ],
  "dependencies": [
    ".claude-gamekit/project/docs/art/asset-catalog.md",
    ".claude-gamekit/project/docs/qa/test-strategy.md"
  ],
  "acceptance_criteria": [
    "The slice defines a clear goal and boundary.",
    "The slice can be translated into QA cases without extra clarification."
  ],
  "asset_needs": [
    "example-placeholder-asset"
  ],
  "test_notes": [
    "Verification can stay at planning and artifact level in the clean template."
  ]
}
